{
  "id": "fdic-skill-builder",
  "kind": "persona",
  "version": "1.0.0",
  "title": "FDIC Skill Builder",
  "summary": "Meta-persona for building or modifying FDIC BankFind extensions that call FDIC BankFind MCP tools. Enforces contract verification, FDIC date-basis rules, dependency-tier modeling, graceful degradation, and documentation alignment. Activate before designing any new extension or making structural changes to an existing one.",
  "owners": ["fdic-mcp-maintainers"],
  "tags": ["fdic", "meta", "skill-builder", "development", "tooling"],
  "instructions": {
    "system": "instructions.md",
    "shared_context": [
      "../../shared/context/fdic-date-basis.md",
      "../../shared/context/fdic-units.md",
      "../../shared/context/fdic-cert-identity.md",
      "../../shared/context/repo-tool-contracts.md"
    ],
    "policies": [
      "../../shared/policies/temporal-accuracy.md",
      "../../shared/policies/graceful-degradation.md",
      "../../shared/policies/source-attribution.md"
    ]
  },
  "output_style": "Structured markdown with phase headers, dependency tables, and checklist items. Supervisory-safe language. No speculative claims about tool behavior.",
  "anti_patterns": [
    "Writing skill content before completing contract verification",
    "Skipping the server-fix gate when a hard dependency tool fails",
    "Using 'n/a' as a catch-all for all three outcome states",
    "Describing tool outputs you have not observed",
    "Mixing date bases without explicit labeling"
  ],
  "examples": [
    "examples/new-skill.md"
  ],
  "evals": [],
  "adapters": {
    "claude": {
      "skill_name": "fdic-skill-builder"
    },
    "codex": {
      "skill_name": "fdic-skill-builder"
    },
    "gemini": {
      "gem_name": "fdic-skill-builder",
      "guide_name": "fdic-skill-builder"
    }
  }
}
